title,pubDate,guid,link,description
Royal Society of Chemistry report says racism 'pervasive',"Wed, 16 Mar 2022 05:11:07 GMT",https://www.bbc.co.uk/news/science-environment-60708712,https://www.bbc.co.uk/news/science-environment-60708712?at_medium=RSS&at_campaign=KARANGA,"Racism is ""pervasive"" in chemical sciences, according to an investigation by the Royal Society of Chemistry."
Government overseen years of decline in NHS - MPs,"Wed, 16 Mar 2022 00:17:31 GMT",https://www.bbc.co.uk/news/health-60754227,https://www.bbc.co.uk/news/health-60754227?at_medium=RSS&at_campaign=KARANGA,"Failures in England pre-date the pandemic, as waiting times rise, a cross-party group says."
Pregnant women should be asked how much they drink,"Wed, 16 Mar 2022 00:29:07 GMT",https://www.bbc.co.uk/news/health-60755520,https://www.bbc.co.uk/news/health-60755520?at_medium=RSS&at_campaign=KARANGA,"Recording drinking in patients' notes will help spot patterns that can harm babies, advice for the NHS says."
Ukraine: Putin will search for a way to save face,"Wed, 16 Mar 2022 00:30:49 GMT",https://www.bbc.co.uk/news/world-europe-60756993,https://www.bbc.co.uk/news/world-europe-60756993?at_medium=RSS&at_campaign=KARANGA,"What might Putin want, to be able to come out of the war looking good in the eyes of Russia's majority?"
Ukraine's wartime rail chief has to be faster than the Russians tracking him,"Tue, 15 Mar 2022 16:51:50 GMT",https://www.bbc.co.uk/news/world-europe-60755198,https://www.bbc.co.uk/news/world-europe-60755198?at_medium=RSS&at_campaign=KARANGA,Ukraine's rail chief says his staff risk their lives to get others to safety amid Russia attacks.
War in Ukraine: What happened on day 20 of Russia's invasion,"Tue, 15 Mar 2022 22:30:02 GMT",https://www.bbc.co.uk/news/world-europe-60755202,https://www.bbc.co.uk/news/world-europe-60755202?at_medium=RSS&at_campaign=KARANGA,"Three PMs visit Kyiv, while staff at a hospital in Mariupol say they are being held like hostages."
Ukraine war: Could Russia use tactical nuclear weapons?,"Wed, 16 Mar 2022 00:32:03 GMT",https://www.bbc.co.uk/news/world-60664169,https://www.bbc.co.uk/news/world-60664169?at_medium=RSS&at_campaign=KARANGA,"Russia's nuclear weapons are 'combat ready', raising fears they could be used on the battlefield."
Nigerian volunteer: 'Fighting in Ukraine is better than living here',"Wed, 16 Mar 2022 00:33:05 GMT",https://www.bbc.co.uk/news/world-africa-60712913,https://www.bbc.co.uk/news/world-africa-60712913?at_medium=RSS&at_campaign=KARANGA,Hundreds of young men across the continent say they want to take up arms in Ukraine.
Ukraine war: Infection and hunger as hundreds hide in Mariupol cellar,"Tue, 15 Mar 2022 15:39:28 GMT",https://www.bbc.co.uk/news/world-europe-60736845,https://www.bbc.co.uk/news/world-europe-60736845?at_medium=RSS&at_campaign=KARANGA,"With no medical help, some are falling ill while sheltering from attacks in besieged Mariupol."
Ukraine UK refugee hosting scheme: Mum-of-four opens home to refugees,"Tue, 15 Mar 2022 16:46:14 GMT",https://www.bbc.co.uk/news/uk-60737095,https://www.bbc.co.uk/news/uk-60737095?at_medium=RSS&at_campaign=KARANGA,"Mandi Arnold, 35, says welcoming more people into her busy home will mean ""more love, more memories""."
Ukraine war: Protester exposes cracks in Kremlin's war message,"Tue, 15 Mar 2022 17:44:33 GMT",https://www.bbc.co.uk/news/world-europe-60749064,https://www.bbc.co.uk/news/world-europe-60749064?at_medium=RSS&at_campaign=KARANGA,Marina Ovsyannikova's moment of protest on TV was extraordinary - but she now faces prosecution.
Ukraine war: One shell that destroyed a family,"Tue, 15 Mar 2022 06:00:27 GMT",https://www.bbc.co.uk/news/world-europe-60742263,https://www.bbc.co.uk/news/world-europe-60742263?at_medium=RSS&at_campaign=KARANGA,A woman recounts the moment her husband and son were killed by a Russian shell in the town of Irpin.
What sanctions are being imposed on Russia over Ukraine invasion?,"Tue, 15 Mar 2022 14:48:36 GMT",https://www.bbc.co.uk/news/world-europe-60125659,https://www.bbc.co.uk/news/world-europe-60125659?at_medium=RSS&at_campaign=KARANGA,Western nations have imposed severe sanctions on Russia over its invasion of Ukraine.
Newspaper headlines: Zelensky's 'Nato concession' as Putin 'turns to Plan C',"Wed, 16 Mar 2022 00:51:03 GMT",https://www.bbc.co.uk/news/blogs-the-papers-60759952,https://www.bbc.co.uk/news/blogs-the-papers-60759952?at_medium=RSS&at_campaign=KARANGA,Ukraine's admission that it will never join Nato leads the papers as Russian bombardment intensifies.
Ukraine: The volunteers racing aid from the UK to the front line,"Wed, 16 Mar 2022 06:01:59 GMT",https://www.bbc.co.uk/news/health-60739969,https://www.bbc.co.uk/news/health-60739969?at_medium=RSS&at_campaign=KARANGA,Volunteers are racing medical supplies from the UK to the Ukrainian front line.
Stormzy tour review: Star praises fans who waited two years to see him,"Wed, 16 Mar 2022 01:56:06 GMT",https://www.bbc.co.uk/news/entertainment-arts-60756983,https://www.bbc.co.uk/news/entertainment-arts-60756983?at_medium=RSS&at_campaign=KARANGA,The star thanks fans who held onto tickets for two years as his Heavy Is The Head tour launches.
Ukraine refugees: Bringing my mother to the UK,"Tue, 15 Mar 2022 18:43:25 GMT",https://www.bbc.co.uk/news/world-europe-60739970,https://www.bbc.co.uk/news/world-europe-60739970?at_medium=RSS&at_campaign=KARANGA,Marianne filmed her experiences of using the Home Office's Ukraine Family Scheme in Poland.
Marina Ovsyannikova: TV protest 'was my own decision',"Tue, 15 Mar 2022 18:28:55 GMT",https://www.bbc.co.uk/news/world-europe-60758621,https://www.bbc.co.uk/news/world-europe-60758621?at_medium=RSS&at_campaign=KARANGA,The Russian state TV employee who staged an anti-war protest during a live bulletin speaks to reporters outside court.
NYC's Met opera house hosts concert in support of Ukraine,"Tue, 15 Mar 2022 23:18:37 GMT",https://www.bbc.co.uk/news/world-europe-60760303,https://www.bbc.co.uk/news/world-europe-60760303?at_medium=RSS&at_campaign=KARANGA,"The Metropolitan Opera holds a concert for Ukraine, opening with the war-torn country's national anthem."
Ukrainian girl in viral video singing Let It Go safe in Poland,"Tue, 15 Mar 2022 14:48:42 GMT",https://www.bbc.co.uk/news/world-europe-60748418,https://www.bbc.co.uk/news/world-europe-60748418?at_medium=RSS&at_campaign=KARANGA,Seven-year-old Amelia was filmed singing a song from Disney's Frozen whilst sheltering in a basement in Ukraine
Hertfordshire gardener smashes own tomato growing record,"Tue, 15 Mar 2022 19:24:50 GMT",https://www.bbc.co.uk/news/uk-england-beds-bucks-herts-60737800,https://www.bbc.co.uk/news/uk-england-beds-bucks-herts-60737800?at_medium=RSS&at_campaign=KARANGA,"Douglas Smith grew more than 1,000 tomatoes on a single stem, breaking his own record."
Couple injured in Alton Towers Smiler crash to marry,"Tue, 15 Mar 2022 11:16:56 GMT",https://www.bbc.co.uk/news/uk-england-stoke-staffordshire-60749626,https://www.bbc.co.uk/news/uk-england-stoke-staffordshire-60749626?at_medium=RSS&at_campaign=KARANGA,Leah Washington and Joe Pugh overcame severe injuries and continued dating after their recoveries.
Potholes near Sir Rod Stewart's Essex home to be fixed in April,"Tue, 15 Mar 2022 10:49:54 GMT",https://www.bbc.co.uk/news/uk-england-essex-60744835,https://www.bbc.co.uk/news/uk-england-essex-60744835?at_medium=RSS&at_campaign=KARANGA,The local authority announces a plan of action after Sir Rod posts videos of himself with a shovel.
Spain skies turn orange after Saharan dust cloud sweeps over country,"Tue, 15 Mar 2022 12:24:00 GMT",https://www.bbc.co.uk/news/world-europe-60752590,https://www.bbc.co.uk/news/world-europe-60752590?at_medium=RSS&at_campaign=KARANGA,"A large area was hit by the dust, which swept across the Mediterranean Sea."
Lord Young barred from debate after falling asleep in Parliament,"Tue, 15 Mar 2022 10:12:55 GMT",https://www.bbc.co.uk/news/uk-politics-60750113,https://www.bbc.co.uk/news/uk-politics-60750113?at_medium=RSS&at_campaign=KARANGA,A Labour member of the House of Lords has been told off for falling asleep in the debating chamber.
The neighbourhood leading a green energy revolution,"Wed, 16 Mar 2022 03:14:13 GMT",https://www.bbc.co.uk/news/business-60241966,https://www.bbc.co.uk/news/business-60241966?at_medium=RSS&at_campaign=KARANGA,A small area of Scotland is the home of a groundbreaking experiment to power homes with green hydrogen.
Brittney Griner: How can a US basketball star just vanish?,"Tue, 15 Mar 2022 23:25:37 GMT",https://www.bbc.co.uk/news/world-us-canada-60701050,https://www.bbc.co.uk/news/world-us-canada-60701050?at_medium=RSS&at_campaign=KARANGA,"Brittney Griner, widely considered the best female player of all time, has been detained in Russia."
Why is turning to Saudi Arabia for oil so controversial?,"Tue, 15 Mar 2022 18:54:05 GMT",https://www.bbc.co.uk/news/world-middle-east-58930311,https://www.bbc.co.uk/news/world-middle-east-58930311?at_medium=RSS&at_campaign=KARANGA,"Nations like the US and UK need to keep in with Saudi Arabia, as they turn away from Russian oil."
Ukraine war: The Telegram group tracing missing relatives,"Wed, 16 Mar 2022 00:24:49 GMT",https://www.bbc.co.uk/news/world-europe-60678083,https://www.bbc.co.uk/news/world-europe-60678083?at_medium=RSS&at_campaign=KARANGA,A group of women work 24/7 to help find loved ones separated by the war in Ukraine.
What are the UK's Living with Covid plans?,"Tue, 15 Mar 2022 15:00:29 GMT",https://www.bbc.co.uk/news/explainers-52530518,https://www.bbc.co.uk/news/explainers-52530518?at_medium=RSS&at_campaign=KARANGA,Scotland and Wales will follow England and Northern Ireland and lift most remaining Covid rules.
Ukraine: Nick Robinson on how Germany is reversing decades of closer ties with Russia,"Tue, 15 Mar 2022 10:51:50 GMT",https://www.bbc.co.uk/news/world-europe-60743342,https://www.bbc.co.uk/news/world-europe-60743342?at_medium=RSS&at_campaign=KARANGA,"Children of the 1989 generation won't enjoy the same freedoms as their parents, writes Nick Robinson in Berlin."
Gucci bag murder: 'Why are shops selling 15-inch machetes?',"Tue, 15 Mar 2022 22:06:39 GMT",https://www.bbc.co.uk/news/uk-wales-60680826,https://www.bbc.co.uk/news/uk-wales-60680826?at_medium=RSS&at_campaign=KARANGA,"After a man was murdered for his Gucci bag, there are concerns over illegal knife sales."
Fears Russia will not be able to pay its debts mount,"Tue, 15 Mar 2022 16:31:34 GMT",https://www.bbc.co.uk/news/business-60750642,https://www.bbc.co.uk/news/business-60750642?at_medium=RSS&at_campaign=KARANGA,The country may be about to default on its debts as Western sanctions over Ukraine bite.
Covid: People scared to sing together after lockdowns,"Tue, 15 Mar 2022 06:04:45 GMT",https://www.bbc.co.uk/news/uk-wales-60662347,https://www.bbc.co.uk/news/uk-wales-60662347?at_medium=RSS&at_campaign=KARANGA,"Only Boys Aloud's founder says people lose the ""freedom to let rip and sing"" over Zoom."
FIA changes F1 safety car rules in wake of controversial 2021 title decider,"Tue, 15 Mar 2022 21:30:05 GMT",https://www.bbc.co.uk/sport/formula1/60758648,https://www.bbc.co.uk/sport/formula1/60758648?at_medium=RSS&at_campaign=KARANGA,Formula 1's safety car rules have been changed to make it impossible for a race to be conducted in the manner of 2021's controversial title decider.
Chelsea withdraw request to play FA Cup tie behind closed doors,"Tue, 15 Mar 2022 22:50:46 GMT",https://www.bbc.co.uk/sport/football/60757919,https://www.bbc.co.uk/sport/football/60757919?at_medium=RSS&at_campaign=KARANGA,Chelsea withdraw their request to play Saturday's FA Cup quarter-final at Middlesbrough behind closed doors.
England keep World Cup hopes alive with impressive victory over India,"Wed, 16 Mar 2022 06:19:04 GMT",https://www.bbc.co.uk/sport/cricket/60760948,https://www.bbc.co.uk/sport/cricket/60760948?at_medium=RSS&at_campaign=KARANGA,Rejuvenated England breathe life into their World Cup defence with a four-wicket hammering of India in Mount Maunganui.
Indian Wells: Britain's Harriet Dart beaten by Madison Keys in fourth round,"Wed, 16 Mar 2022 06:27:35 GMT",https://www.bbc.co.uk/sport/tennis/60759683,https://www.bbc.co.uk/sport/tennis/60759683?at_medium=RSS&at_campaign=KARANGA,British qualifier Harriet Dart loses in straight sets against American Madison Keys in the fourth round at Indian Wells in California.
Nunez heads winner as Benfica beat Ajax to reach last eight,"Tue, 15 Mar 2022 22:11:45 GMT",https://www.bbc.co.uk/sport/football/60758921,https://www.bbc.co.uk/sport/football/60758921?at_medium=RSS&at_campaign=KARANGA,Darwin Nunez scores the winner as Benfica beat Ajax to reach the Champions League quarter-finals.
Nazanin Zaghari-Ratcliffe and Anoosheh Ashoori arrive in UK after being freed from Iran,"Thu, 17 Mar 2022 05:20:59 GMT",https://www.bbc.co.uk/news/uk-60775180,https://www.bbc.co.uk/news/uk-60775180?at_medium=RSS&at_campaign=KARANGA,British-Iranian nationals Nazanin Zaghari-Ratcliffe and Anoosheh Ashoori touched down at RAF Brize Norton just after 01:00 GMT.
Ukraine war: Russians grieve for fallen soldiers,"Thu, 17 Mar 2022 01:08:07 GMT",https://www.bbc.co.uk/news/world-europe-60769509,https://www.bbc.co.uk/news/world-europe-60769509?at_medium=RSS&at_campaign=KARANGA,"Two weeks since the last official death toll, funerals of Russian soldiers killed in Ukraine continue."
War in Ukraine: Fourth Russian general killed - Zelensky,"Wed, 16 Mar 2022 21:00:37 GMT",https://www.bbc.co.uk/news/world-europe-60767664,https://www.bbc.co.uk/news/world-europe-60767664?at_medium=RSS&at_campaign=KARANGA,The news raises questions over why senior Russian officers are getting so close to the fighting.
"Ukraine war: Russia attacks theatre sheltering civilians, Mariupol says","Wed, 16 Mar 2022 20:44:49 GMT",https://www.bbc.co.uk/news/world-europe-60772331,https://www.bbc.co.uk/news/world-europe-60772331?at_medium=RSS&at_campaign=KARANGA,"The building in the besieged city of Mariupol was sheltering up to 1,200 people, the deputy mayor says."
Sophie Lancaster murder: Killer Ryan Herbert to be freed from jail,"Wed, 16 Mar 2022 18:51:15 GMT",https://www.bbc.co.uk/news/uk-england-lancashire-60766768,https://www.bbc.co.uk/news/uk-england-lancashire-60766768?at_medium=RSS&at_campaign=KARANGA,"Ryan Herbert has made ""significant changes to his life"" while in jail, the Parole Board is told."
Man United's Pogba reveals burglary at his home,"Wed, 16 Mar 2022 22:16:22 GMT",https://www.bbc.co.uk/sport/football/60774041,https://www.bbc.co.uk/sport/football/60774041?at_medium=RSS&at_campaign=KARANGA,Manchester United midfielder Paul Pogba says his home was burgled during his side's Champions League game against Atletico Madrid on Tuesday.
Preston man detained for Army veteran's one-punch death,"Wed, 16 Mar 2022 19:30:05 GMT",https://www.bbc.co.uk/news/uk-england-lancashire-60755609,https://www.bbc.co.uk/news/uk-england-lancashire-60755609?at_medium=RSS&at_campaign=KARANGA,"Frank Fishwick, 86, died after he confronted a group of youths outside his flat in Preston."
Jussie Smollett released from jail pending appeal,"Thu, 17 Mar 2022 04:00:33 GMT",https://www.bbc.co.uk/news/world-us-canada-60775521,https://www.bbc.co.uk/news/world-us-canada-60775521?at_medium=RSS&at_campaign=KARANGA,Last week the US actor was sentenced to prison for lying about being the victim of a hate crime.
Dying patients living longer than expected lose NHS funds,"Thu, 17 Mar 2022 00:01:27 GMT",https://www.bbc.co.uk/news/health-60401487,https://www.bbc.co.uk/news/health-60401487?at_medium=RSS&at_campaign=KARANGA,"More than 1,300 people a year are having their palliative care funding withdrawn, BBC analysis shows."
'Dangerous' tanning products promoted by influencers,"Thu, 17 Mar 2022 05:53:19 GMT",https://www.bbc.co.uk/news/health-60348334,https://www.bbc.co.uk/news/health-60348334?at_medium=RSS&at_campaign=KARANGA,"Sprays and injections containing ""melanotan-2"" may lead to cancer, doctors tell a BBC News investigation."
Long-term plan to tackle racial disparity in UK,"Wed, 16 Mar 2022 23:55:01 GMT",https://www.bbc.co.uk/news/education-60769468,https://www.bbc.co.uk/news/education-60769468?at_medium=RSS&at_campaign=KARANGA,"The ""Inclusive Britain"" plan was developed in response to the Black Lives Matter protests in 2020."
Liverpool beat Arsenal to close gap with Man City,"Wed, 16 Mar 2022 22:40:25 GMT",https://www.bbc.co.uk/sport/football/60671958,https://www.bbc.co.uk/sport/football/60671958?at_medium=RSS&at_campaign=KARANGA,"Liverpool close the gap on Premier League leaders Manchester City to a single point after beating Arsenal, who miss the chance to consolidate their place in the top four."
Scientists claim hairy black holes explain Hawking paradox,"Thu, 17 Mar 2022 04:57:23 GMT",https://www.bbc.co.uk/news/science-environment-60708711,https://www.bbc.co.uk/news/science-environment-60708711?at_medium=RSS&at_campaign=KARANGA,"Researchers say they have solved one of science's biggest paradoxes, first identified by Prof Stephen Hawking."
Ros Atkins On... Nazanin Zaghari-Ratcliffe and the Iran debt,"Wed, 16 Mar 2022 23:09:25 GMT",https://www.bbc.co.uk/news/world-60774839,https://www.bbc.co.uk/news/world-60774839?at_medium=RSS&at_campaign=KARANGA,Ros Atkins takes a look at the reasons why two British-Iranian nationals are freed after years in prison.
Nazanin Zaghari-Ratcliffe: Why has she been freed now?,"Thu, 17 Mar 2022 02:08:58 GMT",https://www.bbc.co.uk/news/uk-60768437,https://www.bbc.co.uk/news/uk-60768437?at_medium=RSS&at_campaign=KARANGA,"London-Tehran relations are better, and Iran no longer feels it needs Nazanin Zaghari-Ratcliffe as leverage."
Anoosheh Ashoori: Daughter and wife say they'll welcome him with cake and beer,"Wed, 16 Mar 2022 21:00:26 GMT",https://www.bbc.co.uk/news/uk-60772315,https://www.bbc.co.uk/news/uk-60772315?at_medium=RSS&at_campaign=KARANGA,Anoosheh Ashoori's wife and daughter spoke to the BBC as he flew home from an Iranian prison.
How is a UK debt to Iran connected to Nazanin Zaghari-Ratcliffe?,"Wed, 16 Mar 2022 16:37:45 GMT",https://www.bbc.co.uk/news/world-56376852,https://www.bbc.co.uk/news/world-56376852?at_medium=RSS&at_campaign=KARANGA,Does the UK own money to Iran for a military deal that was never fulfilled?
Nazanin Zaghari-Ratcliffe: Husband looks forward to 'new life',"Wed, 16 Mar 2022 18:41:59 GMT",https://www.bbc.co.uk/news/uk-60769658,https://www.bbc.co.uk/news/uk-60769658?at_medium=RSS&at_campaign=KARANGA,"Richard Ratcliffe said he was ""deeply grateful"" for his wife's release from Iran after nearly six years."
MP's message to Nazanin's daughter: 'Mummy really is coming home',"Thu, 17 Mar 2022 00:16:06 GMT",https://www.bbc.co.uk/news/uk-60772311,https://www.bbc.co.uk/news/uk-60772311?at_medium=RSS&at_campaign=KARANGA,"MP Tulip Siddiq pays tribute to Nazanin Zaghari-Ratcliffe's husband Richard, as she returns from Iran."
Who is Nazanin Zaghari-Ratcliffe and why was she jailed in Iran?,"Wed, 16 Mar 2022 14:11:52 GMT",https://www.bbc.co.uk/news/uk-politics-42252741,https://www.bbc.co.uk/news/uk-politics-42252741?at_medium=RSS&at_campaign=KARANGA,"Why a British-Iranian mother came to be jailed in Tehran, and the details of the case against her."
"The Papers: Nazanin free and Russia 'hits theatre holding 1,200'","Thu, 17 Mar 2022 00:13:20 GMT",https://www.bbc.co.uk/news/blogs-the-papers-60774400,https://www.bbc.co.uk/news/blogs-the-papers-60774400?at_medium=RSS&at_campaign=KARANGA,The release of Nazanin Zaghari-Ratcliffe leads the papers - along with the continued shelling of the city of Mariupol.
Covid: Why US students are staging walkouts over masks,"Thu, 17 Mar 2022 00:42:51 GMT",https://www.bbc.co.uk/news/world-us-canada-60745568,https://www.bbc.co.uk/news/world-us-canada-60745568?at_medium=RSS&at_campaign=KARANGA,Schools across the US are dropping mask mandates - but students are divided over the issue.
In pictures: 2022 Sony World Photography Awards,"Thu, 17 Mar 2022 00:08:14 GMT",https://www.bbc.co.uk/news/in-pictures-60752777,https://www.bbc.co.uk/news/in-pictures-60752777?at_medium=RSS&at_campaign=KARANGA,The winners of the Open category of the 2022 Sony World Photography Awards have been announced.
Why your fish and chips may cost a lot more,"Thu, 17 Mar 2022 00:01:46 GMT",https://www.bbc.co.uk/news/business-60762921,https://www.bbc.co.uk/news/business-60762921?at_medium=RSS&at_campaign=KARANGA,The conflict in Ukraine is a long way from the UK but it means fish and chip shops are seeing prices soar.
Special access inside Big Ben's newly refurbished clock tower,"Thu, 17 Mar 2022 00:01:27 GMT",https://www.bbc.co.uk/news/uk-politics-60755139,https://www.bbc.co.uk/news/uk-politics-60755139?at_medium=RSS&at_campaign=KARANGA,The restoration project of Big Ben is almost over and scaffolding around the clock has been removed.
War in Ukraine: Surrogate babies wait for parents in Kyiv bomb shelter,"Wed, 16 Mar 2022 09:45:07 GMT",https://www.bbc.co.uk/news/world-europe-60764100,https://www.bbc.co.uk/news/world-europe-60764100?at_medium=RSS&at_campaign=KARANGA,At least 21 infants born through surrogacy are left in limbo because of the war in Ukraine.
First pictures of earthquake hitting Japan,"Wed, 16 Mar 2022 16:42:28 GMT",https://www.bbc.co.uk/news/world-asia-60771694,https://www.bbc.co.uk/news/world-asia-60771694?at_medium=RSS&at_campaign=KARANGA,"Cameras shake as a powerful tremor in north-east Japan strikes, cutting power to millions of people."
Travel firms confident they can bounce back in 2022,"Thu, 17 Mar 2022 00:15:39 GMT",https://www.bbc.co.uk/news/business-60748731,https://www.bbc.co.uk/news/business-60748731?at_medium=RSS&at_campaign=KARANGA,"Despite the threat of higher airline ticket prices, the industry is still upbeat as bookings are rising."
Covid-19 in the UK: How many coronavirus cases are there in my area?,"Thu, 17 Mar 2022 03:03:36 GMT",https://www.bbc.co.uk/news/uk-51768274,https://www.bbc.co.uk/news/uk-51768274?at_medium=RSS&at_campaign=KARANGA,Explore the data on coronavirus in the UK and find out how many cases there are in your area.
Selling sex to survive in Iran,"Thu, 17 Mar 2022 01:25:33 GMT",https://www.bbc.co.uk/news/world-middle-east-60661875,https://www.bbc.co.uk/news/world-middle-east-60661875?at_medium=RSS&at_campaign=KARANGA,"Women and men are increasingly turning to prostitution to pay the bills, despite official denials."
TV classic's radio revival to reveal what Our Friends in the North did next,"Thu, 17 Mar 2022 03:08:59 GMT",https://www.bbc.co.uk/news/entertainment-arts-60748464,https://www.bbc.co.uk/news/entertainment-arts-60748464?at_medium=RSS&at_campaign=KARANGA,The classic TV drama is adapted for the radio and brought up to date with a new episode set in 2020.
Hidilyn Diaz: From accusations of anti-government plot to historic Olympic gold,"Wed, 16 Mar 2022 23:59:47 GMT",https://www.bbc.co.uk/sport/weightlifting/59660304,https://www.bbc.co.uk/sport/weightlifting/59660304?at_medium=RSS&at_campaign=KARANGA,Hidilyn Diaz was accused of plotting against the Philippine government. Then she won her country's first Olympic gold.
Top Boy after George Floyd 'will be eye-opening' for some,"Thu, 17 Mar 2022 03:01:17 GMT",https://www.bbc.co.uk/news/newsbeat-60765574,https://www.bbc.co.uk/news/newsbeat-60765574?at_medium=RSS&at_campaign=KARANGA,Actor Ashley Walters says police brutality in the UK is reflected in the fourth series of the Netflix show.
Afghans turn to cryptocurrencies amid US sanctions,"Wed, 16 Mar 2022 00:49:15 GMT",https://www.bbc.co.uk/news/world-asia-60715707,https://www.bbc.co.uk/news/world-asia-60715707?at_medium=RSS&at_campaign=KARANGA,"US sanctions, failing banks, and the drying up of foreign aid have left Afghanistan's economy in tatters."
Brittney Griner: How can a US basketball star just vanish?,"Wed, 16 Mar 2022 08:14:41 GMT",https://www.bbc.co.uk/news/world-us-canada-60701050,https://www.bbc.co.uk/news/world-us-canada-60701050?at_medium=RSS&at_campaign=KARANGA,"Brittney Griner, widely considered the best female player of all time, has been detained in Russia."
Arsenal 0-2 Liverpool: Relentless Reds throw down the gauntlet to Premier League leaders Man City,"Wed, 16 Mar 2022 23:57:08 GMT",https://www.bbc.co.uk/sport/football/60774931,https://www.bbc.co.uk/sport/football/60774931?at_medium=RSS&at_campaign=KARANGA,Liverpool manager Jurgen Klopp's triple fist pump after Wednesday's 2-0 win at Arsenal could just as easily have been the sound of a gauntlet being thrown down in front of Manchester City.
Root hits ton as England take command against West Indies,"Wed, 16 Mar 2022 22:13:53 GMT",https://www.bbc.co.uk/sport/cricket/60768447,https://www.bbc.co.uk/sport/cricket/60768447?at_medium=RSS&at_campaign=KARANGA,Joe Root punishes West Indies with yet another century as England take command on day one of the second Test in Barbados.
'He deserves to win something in his career' - Conte praises Kane for record goal in victory at Brighton,"Wed, 16 Mar 2022 23:24:29 GMT",https://www.bbc.co.uk/sport/football/59536759,https://www.bbc.co.uk/sport/football/59536759?at_medium=RSS&at_campaign=KARANGA,Harry Kane scores as Tottenham reignite their top-four hopes by condemning Brighton to a sixth successive Premier League defeat.
"Verstappen says F1 does not need to heal, but Netflix series is 'faking rivalries'","Wed, 16 Mar 2022 22:02:19 GMT",https://www.bbc.co.uk/sport/formula1/60764810,https://www.bbc.co.uk/sport/formula1/60764810?at_medium=RSS&at_campaign=KARANGA,"World champion Max Verstappen says F1 ""does not need to heal"" after last year's controversial title decider."
